<?xml version="1.0" encoding="UTF-8" ?>
<!-- edited with XMLSPY v5 rel. 3 U (http://www.xmlspy.com) by Josh Lurz (PNNL) -->
<xs:schema xmlns:xs="http://www.w3.org/2001/XMLSchema" elementFormDefault="qualified" attributeFormDefault="unqualified">
	<xs:element name="Configuration">
		<xs:annotation>
			<xs:documentation>Contains configuration values for CIAM</xs:documentation>
		</xs:annotation>
		<xs:complexType>
			<xs:sequence>
				<xs:element name="Files" type="strType" />
				<xs:element name="Strings" type="strType" />
				<xs:element name="Bools">
					<xs:complexType>
						<xs:sequence>
							<xs:element name="Value" minOccurs="0" maxOccurs="unbounded">
								<xs:complexType>
									<xs:simpleContent>
										<xs:extension base="xs:int">
											<xs:attribute name="name" type="xs:string" use="required" />
										</xs:extension>
									</xs:simpleContent>
								</xs:complexType>
							</xs:element>
						</xs:sequence>
					</xs:complexType>
				</xs:element>
				<xs:element name="Ints">
					<xs:complexType>
						<xs:sequence>
							<xs:element name="Value" minOccurs="0" maxOccurs="unbounded">
								<xs:complexType>
									<xs:simpleContent>
										<xs:extension base="xs:int">
											<xs:attribute name="name" type="xs:string" use="required" />
										</xs:extension>
									</xs:simpleContent>
								</xs:complexType>
							</xs:element>
						</xs:sequence>
					</xs:complexType>
				</xs:element>
				<xs:element name="Doubles">
					<xs:complexType>
						<xs:sequence>
							<xs:element name="Value" minOccurs="0" maxOccurs="unbounded">
								<xs:complexType>
									<xs:simpleContent>
										<xs:extension base="xs:double">
											<xs:attribute name="name" type="xs:string" use="required" />
										</xs:extension>
									</xs:simpleContent>
								</xs:complexType>
							</xs:element>
						</xs:sequence>
					</xs:complexType>
				</xs:element>
			</xs:sequence>
		</xs:complexType>
	</xs:element>
	<xs:complexType name="strType">
		<xs:sequence>
			<xs:element name="Value" minOccurs="0" maxOccurs="unbounded">
				<xs:complexType>
					<xs:simpleContent>
						<xs:extension base="xs:string">
							<xs:attribute name="name" type="xs:string" use="required" />
						</xs:extension>
					</xs:simpleContent>
				</xs:complexType>
			</xs:element>
		</xs:sequence>
	</xs:complexType>
</xs:schema>
